failed to get console mode for stdout: The handle is invalid.
failed to get console mode for stdout: The handle is invalid.
[1A[1B[0G[?25l[+] Running 4/0
 - Container musicplace_redis     Running 0.0s
 - Container musicplace_influxdb  Running 0.0s
 - Container musicplace_mysql     Running 0.0s
 - Container musicplace_app       Running 0.0s
[?25hfailed to get console mode for stdout: The handle is invalid.
[1A[1B[0G[?25l[+] Running 0/0
 - Container musicplace_mysql  Waiting 0.1s
 - Container musicplace_redis  Waiting 0.1s
[?25h[1A[1A[1A[0G[?25l[+] Running 0/2
 - Container musicplace_mysql  Waiting 0.2s
 - Container musicplace_redis  Waiting 0.2s
[?25h[1A[1A[1A[0G[?25l[+] Running 0/2
 - Container musicplace_mysql  Waiting 0.3s
 - Container musicplace_redis  Waiting 0.3s
[?25h[1A[1A[1A[0G[?25l[+] Running 0/2
 - Container musicplace_mysql  Waiting 0.4s
 - Container musicplace_redis  Waiting 0.4s
[?25h[1A[1A[1A[0G[?25l[+] Running 0/2
 - Container musicplace_mysql  Waiting 0.5s
 - Container musicplace_redis  Waiting 0.5s
[?25h[1A[1A[1A[0G[?25l[34m[+] Running 2/2[0m
 - Container musicplace_mysql  Healthy 0.5s
 - Container musicplace_redis  Healthy 0.5s
[?25h
         /\      Grafana   /?얄?  
    /\  /  \     |\  __   /  /   
   /  \/    \    | |/ /  /   ?얄? 
  /          \   |   (  |  (??  |
 / __________ \  |_|\_\  \_____/ 

     execution: local
        script: /scripts/scenarios/01-warmup.js
        output: InfluxDBv1 (http://influxdb:8086)

     scenarios: (100.00%) 1 scenario, 5 max VUs, 2m30s max duration (incl. graceful stop):
              * default: 5 looping VUs for 2m0s (gracefulStop: 30s)


running (0m01.0s), 5/5 VUs, 0 complete and 0 interrupted iterations
default   [   1% ] 5 VUs  0m01.0s/2m0s

running (0m02.0s), 5/5 VUs, 0 complete and 0 interrupted iterations
default   [   2% ] 5 VUs  0m02.0s/2m0s

running (0m03.0s), 5/5 VUs, 0 complete and 0 interrupted iterations
default   [   2% ] 5 VUs  0m03.0s/2m0s

running (0m04.0s), 5/5 VUs, 0 complete and 0 interrupted iterations
default   [   3% ] 5 VUs  0m04.0s/2m0s

running (0m05.0s), 5/5 VUs, 5 complete and 0 interrupted iterations
default   [   4% ] 5 VUs  0m05.0s/2m0s

running (0m06.0s), 5/5 VUs, 5 complete and 0 interrupted iterations
default   [   5% ] 5 VUs  0m06.0s/2m0s

running (0m07.0s), 5/5 VUs, 5 complete and 0 interrupted iterations
default   [   6% ] 5 VUs  0m07.0s/2m0s

running (0m08.0s), 5/5 VUs, 5 complete and 0 interrupted iterations
default   [   7% ] 5 VUs  0m08.0s/2m0s

running (0m09.0s), 5/5 VUs, 10 complete and 0 interrupted iterations
default   [   7% ] 5 VUs  0m09.0s/2m0s

running (0m10.0s), 5/5 VUs, 10 complete and 0 interrupted iterations
default   [   8% ] 5 VUs  0m10.0s/2m0s

running (0m11.0s), 5/5 VUs, 10 complete and 0 interrupted iterations
default   [   9% ] 5 VUs  0m11.0s/2m0s

running (0m12.0s), 5/5 VUs, 10 complete and 0 interrupted iterations
default   [  10% ] 5 VUs  0m12.0s/2m0s

running (0m13.0s), 5/5 VUs, 15 complete and 0 interrupted iterations
default   [  11% ] 5 VUs  0m13.0s/2m0s

running (0m14.0s), 5/5 VUs, 15 complete and 0 interrupted iterations
default   [  12% ] 5 VUs  0m14.0s/2m0s

running (0m15.0s), 5/5 VUs, 15 complete and 0 interrupted iterations
default   [  12% ] 5 VUs  0m15.0s/2m0s

running (0m16.0s), 5/5 VUs, 15 complete and 0 interrupted iterations
default   [  13% ] 5 VUs  0m16.0s/2m0s

running (0m17.0s), 5/5 VUs, 20 complete and 0 interrupted iterations
default   [  14% ] 5 VUs  0m17.0s/2m0s

running (0m18.0s), 5/5 VUs, 20 complete and 0 interrupted iterations
default   [  15% ] 5 VUs  0m18.0s/2m0s

running (0m19.0s), 5/5 VUs, 20 complete and 0 interrupted iterations
default   [  16% ] 5 VUs  0m19.0s/2m0s

running (0m20.0s), 5/5 VUs, 20 complete and 0 interrupted iterations
default   [  17% ] 5 VUs  0m20.0s/2m0s

running (0m21.0s), 5/5 VUs, 25 complete and 0 interrupted iterations
default   [  17% ] 5 VUs  0m21.0s/2m0s

running (0m22.0s), 5/5 VUs, 25 complete and 0 interrupted iterations
default   [  18% ] 5 VUs  0m22.0s/2m0s

running (0m23.0s), 5/5 VUs, 25 complete and 0 interrupted iterations
default   [  19% ] 5 VUs  0m23.0s/2m0s

running (0m24.0s), 5/5 VUs, 25 complete and 0 interrupted iterations
default   [  20% ] 5 VUs  0m24.0s/2m0s

running (0m25.0s), 5/5 VUs, 30 complete and 0 interrupted iterations
default   [  21% ] 5 VUs  0m25.0s/2m0s

running (0m26.0s), 5/5 VUs, 30 complete and 0 interrupted iterations
default   [  22% ] 5 VUs  0m26.0s/2m0s

running (0m27.0s), 5/5 VUs, 30 complete and 0 interrupted iterations
default   [  22% ] 5 VUs  0m27.0s/2m0s

running (0m28.0s), 5/5 VUs, 30 complete and 0 interrupted iterations
default   [  23% ] 5 VUs  0m28.0s/2m0s

running (0m29.0s), 5/5 VUs, 30 complete and 0 interrupted iterations
default   [  24% ] 5 VUs  0m29.0s/2m0s

running (0m30.0s), 5/5 VUs, 35 complete and 0 interrupted iterations
default   [  25% ] 5 VUs  0m30.0s/2m0s

running (0m31.0s), 5/5 VUs, 35 complete and 0 interrupted iterations
default   [  26% ] 5 VUs  0m31.0s/2m0s

running (0m32.0s), 5/5 VUs, 35 complete and 0 interrupted iterations
default   [  27% ] 5 VUs  0m32.0s/2m0s

running (0m33.0s), 5/5 VUs, 35 complete and 0 interrupted iterations
default   [  27% ] 5 VUs  0m33.0s/2m0s

running (0m34.0s), 5/5 VUs, 40 complete and 0 interrupted iterations
default   [  28% ] 5 VUs  0m34.0s/2m0s

running (0m35.0s), 5/5 VUs, 40 complete and 0 interrupted iterations
default   [  29% ] 5 VUs  0m35.0s/2m0s

running (0m36.0s), 5/5 VUs, 40 complete and 0 interrupted iterations
default   [  30% ] 5 VUs  0m36.0s/2m0s

running (0m37.0s), 5/5 VUs, 40 complete and 0 interrupted iterations
default   [  31% ] 5 VUs  0m37.0s/2m0s

running (0m38.0s), 5/5 VUs, 45 complete and 0 interrupted iterations
default   [  32% ] 5 VUs  0m38.0s/2m0s

running (0m39.0s), 5/5 VUs, 45 complete and 0 interrupted iterations
default   [  32% ] 5 VUs  0m39.0s/2m0s

running (0m40.0s), 5/5 VUs, 45 complete and 0 interrupted iterations
default   [  33% ] 5 VUs  0m40.0s/2m0s

running (0m41.0s), 5/5 VUs, 45 complete and 0 interrupted iterations
default   [  34% ] 5 VUs  0m41.0s/2m0s

running (0m42.0s), 5/5 VUs, 50 complete and 0 interrupted iterations
default   [  35% ] 5 VUs  0m42.0s/2m0s

running (0m43.0s), 5/5 VUs, 50 complete and 0 interrupted iterations
default   [  36% ] 5 VUs  0m43.0s/2m0s

running (0m44.0s), 5/5 VUs, 50 complete and 0 interrupted iterations
default   [  37% ] 5 VUs  0m44.0s/2m0s

running (0m45.0s), 5/5 VUs, 50 complete and 0 interrupted iterations
default   [  37% ] 5 VUs  0m45.0s/2m0s

running (0m46.0s), 5/5 VUs, 55 complete and 0 interrupted iterations
default   [  38% ] 5 VUs  0m46.0s/2m0s

running (0m47.0s), 5/5 VUs, 55 complete and 0 interrupted iterations
default   [  39% ] 5 VUs  0m47.0s/2m0s

running (0m48.0s), 5/5 VUs, 55 complete and 0 interrupted iterations
default   [  40% ] 5 VUs  0m48.0s/2m0s

running (0m49.0s), 5/5 VUs, 55 complete and 0 interrupted iterations
default   [  41% ] 5 VUs  0m49.0s/2m0s

running (0m50.0s), 5/5 VUs, 60 complete and 0 interrupted iterations
default   [  42% ] 5 VUs  0m50.0s/2m0s

running (0m51.0s), 5/5 VUs, 60 complete and 0 interrupted iterations
default   [  42% ] 5 VUs  0m51.0s/2m0s

running (0m52.0s), 5/5 VUs, 60 complete and 0 interrupted iterations
default   [  43% ] 5 VUs  0m52.0s/2m0s

running (0m53.0s), 5/5 VUs, 60 complete and 0 interrupted iterations
default   [  44% ] 5 VUs  0m53.0s/2m0s

running (0m54.0s), 5/5 VUs, 65 complete and 0 interrupted iterations
default   [  45% ] 5 VUs  0m54.0s/2m0s

running (0m55.0s), 5/5 VUs, 65 complete and 0 interrupted iterations
default   [  46% ] 5 VUs  0m55.0s/2m0s

running (0m56.0s), 5/5 VUs, 65 complete and 0 interrupted iterations
default   [  47% ] 5 VUs  0m56.0s/2m0s

running (0m57.0s), 5/5 VUs, 65 complete and 0 interrupted iterations
default   [  47% ] 5 VUs  0m57.0s/2m0s

running (0m58.0s), 5/5 VUs, 70 complete and 0 interrupted iterations
default   [  48% ] 5 VUs  0m58.0s/2m0s

running (0m59.0s), 5/5 VUs, 70 complete and 0 interrupted iterations
default   [  49% ] 5 VUs  0m59.0s/2m0s

running (1m00.0s), 5/5 VUs, 70 complete and 0 interrupted iterations
default   [  50% ] 5 VUs  1m00.0s/2m0s

running (1m01.0s), 5/5 VUs, 70 complete and 0 interrupted iterations
default   [  51% ] 5 VUs  1m01.0s/2m0s

running (1m02.0s), 5/5 VUs, 75 complete and 0 interrupted iterations
default   [  52% ] 5 VUs  1m02.0s/2m0s

running (1m03.0s), 5/5 VUs, 75 complete and 0 interrupted iterations
default   [  52% ] 5 VUs  1m03.0s/2m0s

running (1m04.0s), 5/5 VUs, 75 complete and 0 interrupted iterations
default   [  53% ] 5 VUs  1m04.0s/2m0s

running (1m05.0s), 5/5 VUs, 75 complete and 0 interrupted iterations
default   [  54% ] 5 VUs  1m05.0s/2m0s

running (1m06.0s), 5/5 VUs, 80 complete and 0 interrupted iterations
default   [  55% ] 5 VUs  1m06.0s/2m0s

running (1m07.0s), 5/5 VUs, 80 complete and 0 interrupted iterations
default   [  56% ] 5 VUs  1m07.0s/2m0s

running (1m08.0s), 5/5 VUs, 80 complete and 0 interrupted iterations
default   [  57% ] 5 VUs  1m08.0s/2m0s

running (1m09.0s), 5/5 VUs, 80 complete and 0 interrupted iterations
default   [  57% ] 5 VUs  1m09.0s/2m0s

running (1m10.0s), 5/5 VUs, 85 complete and 0 interrupted iterations
default   [  58% ] 5 VUs  1m10.0s/2m0s

running (1m11.0s), 5/5 VUs, 85 complete and 0 interrupted iterations
default   [  59% ] 5 VUs  1m11.0s/2m0s

running (1m12.0s), 5/5 VUs, 85 complete and 0 interrupted iterations
default   [  60% ] 5 VUs  1m12.0s/2m0s

running (1m13.0s), 5/5 VUs, 85 complete and 0 interrupted iterations
default   [  61% ] 5 VUs  1m13.0s/2m0s

running (1m14.0s), 5/5 VUs, 85 complete and 0 interrupted iterations
default   [  62% ] 5 VUs  1m14.0s/2m0s

running (1m15.0s), 5/5 VUs, 90 complete and 0 interrupted iterations
default   [  62% ] 5 VUs  1m15.0s/2m0s

running (1m16.0s), 5/5 VUs, 90 complete and 0 interrupted iterations
default   [  63% ] 5 VUs  1m16.0s/2m0s

running (1m17.0s), 5/5 VUs, 90 complete and 0 interrupted iterations
default   [  64% ] 5 VUs  1m17.0s/2m0s

running (1m18.0s), 5/5 VUs, 90 complete and 0 interrupted iterations
default   [  65% ] 5 VUs  1m18.0s/2m0s

running (1m19.0s), 5/5 VUs, 95 complete and 0 interrupted iterations
default   [  66% ] 5 VUs  1m19.0s/2m0s

running (1m20.0s), 5/5 VUs, 95 complete and 0 interrupted iterations
default   [  67% ] 5 VUs  1m20.0s/2m0s

running (1m21.0s), 5/5 VUs, 95 complete and 0 interrupted iterations
default   [  67% ] 5 VUs  1m21.0s/2m0s

running (1m22.0s), 5/5 VUs, 95 complete and 0 interrupted iterations
default   [  68% ] 5 VUs  1m22.0s/2m0s

running (1m23.0s), 5/5 VUs, 100 complete and 0 interrupted iterations
default   [  69% ] 5 VUs  1m23.0s/2m0s

running (1m24.0s), 5/5 VUs, 100 complete and 0 interrupted iterations
default   [  70% ] 5 VUs  1m24.0s/2m0s

running (1m25.0s), 5/5 VUs, 100 complete and 0 interrupted iterations
default   [  71% ] 5 VUs  1m25.0s/2m0s

running (1m26.0s), 5/5 VUs, 100 complete and 0 interrupted iterations
default   [  72% ] 5 VUs  1m26.0s/2m0s

running (1m27.0s), 5/5 VUs, 105 complete and 0 interrupted iterations
default   [  72% ] 5 VUs  1m27.0s/2m0s

running (1m28.0s), 5/5 VUs, 105 complete and 0 interrupted iterations
default   [  73% ] 5 VUs  1m28.0s/2m0s

running (1m29.0s), 5/5 VUs, 105 complete and 0 interrupted iterations
default   [  74% ] 5 VUs  1m29.0s/2m0s

running (1m30.0s), 5/5 VUs, 105 complete and 0 interrupted iterations
default   [  75% ] 5 VUs  1m30.0s/2m0s

running (1m31.0s), 5/5 VUs, 110 complete and 0 interrupted iterations
default   [  76% ] 5 VUs  1m31.0s/2m0s

running (1m32.0s), 5/5 VUs, 110 complete and 0 interrupted iterations
default   [  77% ] 5 VUs  1m32.0s/2m0s

running (1m33.0s), 5/5 VUs, 110 complete and 0 interrupted iterations
default   [  77% ] 5 VUs  1m33.0s/2m0s

running (1m34.0s), 5/5 VUs, 110 complete and 0 interrupted iterations
default   [  78% ] 5 VUs  1m34.0s/2m0s

running (1m35.0s), 5/5 VUs, 115 complete and 0 interrupted iterations
default   [  79% ] 5 VUs  1m35.0s/2m0s

running (1m36.0s), 5/5 VUs, 115 complete and 0 interrupted iterations
default   [  80% ] 5 VUs  1m36.0s/2m0s

running (1m37.0s), 5/5 VUs, 115 complete and 0 interrupted iterations
default   [  81% ] 5 VUs  1m37.0s/2m0s

running (1m38.0s), 5/5 VUs, 115 complete and 0 interrupted iterations
default   [  82% ] 5 VUs  1m38.0s/2m0s

running (1m39.0s), 5/5 VUs, 120 complete and 0 interrupted iterations
default   [  82% ] 5 VUs  1m39.0s/2m0s

running (1m40.0s), 5/5 VUs, 120 complete and 0 interrupted iterations
default   [  83% ] 5 VUs  1m40.0s/2m0s

running (1m41.0s), 5/5 VUs, 120 complete and 0 interrupted iterations
default   [  84% ] 5 VUs  1m41.0s/2m0s

running (1m42.0s), 5/5 VUs, 120 complete and 0 interrupted iterations
default   [  85% ] 5 VUs  1m42.0s/2m0s

running (1m43.0s), 5/5 VUs, 125 complete and 0 interrupted iterations
default   [  86% ] 5 VUs  1m43.0s/2m0s

running (1m44.0s), 5/5 VUs, 125 complete and 0 interrupted iterations
default   [  87% ] 5 VUs  1m44.0s/2m0s

running (1m45.0s), 5/5 VUs, 125 complete and 0 interrupted iterations
default   [  87% ] 5 VUs  1m45.0s/2m0s

running (1m46.0s), 5/5 VUs, 125 complete and 0 interrupted iterations
default   [  88% ] 5 VUs  1m46.0s/2m0s

running (1m47.0s), 5/5 VUs, 130 complete and 0 interrupted iterations
default   [  89% ] 5 VUs  1m47.0s/2m0s

running (1m48.0s), 5/5 VUs, 130 complete and 0 interrupted iterations
default   [  90% ] 5 VUs  1m48.0s/2m0s

running (1m49.0s), 5/5 VUs, 130 complete and 0 interrupted iterations
default   [  91% ] 5 VUs  1m49.0s/2m0s

running (1m50.0s), 5/5 VUs, 130 complete and 0 interrupted iterations
default   [  92% ] 5 VUs  1m50.0s/2m0s

running (1m51.0s), 5/5 VUs, 135 complete and 0 interrupted iterations
default   [  92% ] 5 VUs  1m51.0s/2m0s

running (1m52.0s), 5/5 VUs, 135 complete and 0 interrupted iterations
default   [  93% ] 5 VUs  1m52.0s/2m0s

running (1m53.0s), 5/5 VUs, 135 complete and 0 interrupted iterations
default   [  94% ] 5 VUs  1m53.0s/2m0s

running (1m54.0s), 5/5 VUs, 135 complete and 0 interrupted iterations
default   [  95% ] 5 VUs  1m54.0s/2m0s

running (1m55.0s), 5/5 VUs, 140 complete and 0 interrupted iterations
default   [  96% ] 5 VUs  1m55.0s/2m0s

running (1m56.0s), 5/5 VUs, 140 complete and 0 interrupted iterations
default   [  97% ] 5 VUs  1m56.0s/2m0s

running (1m57.0s), 5/5 VUs, 140 complete and 0 interrupted iterations
default   [  97% ] 5 VUs  1m57.0s/2m0s

running (1m58.0s), 5/5 VUs, 140 complete and 0 interrupted iterations
default   [  98% ] 5 VUs  1m58.0s/2m0s

running (1m59.0s), 5/5 VUs, 145 complete and 0 interrupted iterations
default   [  99% ] 5 VUs  1m59.0s/2m0s

running (2m00.0s), 5/5 VUs, 145 complete and 0 interrupted iterations
default   [ 100% ] 5 VUs  2m00.0s/2m0s

running (2m01.0s), 5/5 VUs, 145 complete and 0 interrupted iterations
default ??[ 100% ] 5 VUs  2m0s

running (2m02.0s), 5/5 VUs, 145 complete and 0 interrupted iterations
default ??[ 100% ] 5 VUs  2m0s


  ??THRESHOLDS 

    http_req_duration
    ??'p(95)<500' p(95)=84.34ms

    http_req_failed
    ??'rate<0.1' rate=0.00%


  ??TOTAL RESULTS 

    checks_total.......: 600     4.882869/s
    checks_succeeded...: 100.00% 600 out of 600
    checks_failed......: 0.00%   0 out of 600

    ??health check status 200
    ??hello status 200
    ??login status 200
    ??token received

    HTTP
    http_req_duration..............: avg=31.11ms min=1.31ms med=5.18ms max=376.64ms p(90)=76.38ms p(95)=84.34ms
      { expected_response:true }...: avg=31.11ms min=1.31ms med=5.18ms max=376.64ms p(90)=76.38ms p(95)=84.34ms
    http_req_failed................: 0.00%  0 out of 450
    http_reqs......................: 450    3.662152/s

    EXECUTION
    iteration_duration.............: avg=4.09s   min=4.06s  med=4.07s  max=4.4s     p(90)=4.1s    p(95)=4.14s  
    iterations.....................: 150    1.220717/s
    vus............................: 5      min=5        max=5
    vus_max........................: 5      min=5        max=5

    NETWORK
    data_received..................: 254 kB 2.1 kB/s
    data_sent......................: 48 kB  387 B/s




running (2m02.9s), 0/5 VUs, 150 complete and 0 interrupted iterations
default ??[ 100% ] 5 VUs  2m0s
